Events;French;English;Spanish
Intro;L'histoire se déroule sur le continent de Pangée.;Hello;Hola
Intro;Un conflit s'organise entre deux royaumes.;How are you ?;Como buene ?
Intro;"Tout le monde souhaite la paix, mais à quel prix ?";Good day isn't it ?;Bueno journo tambien ?
MainEvent-1;"Elvin, mon garçon, approche, je dois te parler.";"Elvin, grow up man !";"Elvin, no sabemos qué pasar..."
MainEvent-1;Oui père ?;Nooo way !;Quéééé ???
MainEvent-1;"Je vais te confier la magie de notre peuple, la transformation en serpent.";"I'll push you into a magic hell, bitch";Té fisto del so papa
MainEvent-1;Déjà ? Ne faut-il pas suivre un entrainement approprié ?;Suck up;"Qué cé dice, conardo ?"
MainEvent-1;"Tu es prêt, et tu vas devoir partir en dehors do royaume pour accomplir une";"You go to military school, boy";Ta mama y ta papa prefero qué tu parta de la casa.
MainEvent-1;Laquelle père ?;Fuck;Fucko
MainEvent-1;"Trouver un artéfact capable de nous garantir la paix, fils.";You'll find new bitches;Te trouva una bambina en la savana.
M1-Assyrium-Archerie;Vous voulez vous entrainer au tir à l'arc Seigneur Elvin ?;;
M1-Assyrium-Archerie;Plutôt à l'esquive.;;
M1-Assyrium-Archerie;Okay voyons comment vous vous en sortez.;;
M1-Assyrium-Caserne;Un peu d'entrainement mon seigneur ?;;
M1-Assyrium-Caserne;"Pas d'arme pour moi, mais essayez donc de m'attraper !";;
M1-Assyrium-Caserne;"Très bien, allons-y.";;
M1-Assyrium-Habitations;"Aujourd'hui Beige est vraiment remonté contre Cristoff, il va surement lui arracher la tête !";;
M1-Assyrium-Habitations;Il parait que Montodal a été payé un bon pactole pour perdre face à Hijack.;;
M1-Assyrium-Lice;"C'est l'heure du tournois, c'est le moment de parier !";;
M1-Assyrium-Lice;"Et c'est Beige le grand gagnant, venez récupérez vos prix !";;
M1-Assyrium-Trone;"Elvin ! Quelle bonne surprise, que fais-tu par ici ?";;
M1-Assyrium-Trone;"On m'a formé au polymorphisme, alors... j'ai décidé de partir à l'aventure.";;
M1-Assyrium-Trone;"Non vraiment, je sais que tu es en mission.";;
M1-Assyrium-Trone;Oui... en fait mon père a peur de la guerre.;;
M1-Assyrium-Trone;Comme d'habitude...;;
M1-Assyrium-Trone;Il veut que je lui trouve un artéfact capable de protéger notre royaume.;;
M1-Assyrium-Trone;Si ça peut lui faire plaisir. Je peux te conseiller plusieurs endroits.;;
M1-Capitor-Habitations;;;
M1-Capitor-Habitations;;;
M1-Capitor-Habitations;;;
M1-Capitor-Habitations;;;
M1-Capitor-Habitations;;;
M1-Carling-Fontaine;"Bonjour, que faites vous assise ici ?";;
M1-Carling-Fontaine;Cette eau sert aux marmites que vous voyez dehors.;;
M1-Carling-Fontaine;"Oh, je vois.";;
M1-Carling-Fontaine;"Elle est sacrée, je veille sur elle, de nombreux habitants s'attèlent dur à la tâche pour la purifier autant que possible.";;
M1-Carling-Habitations;J'ai perdu ma boucle d'oreille !;;
M1-Carling-Habitations;"Tais toi donc, tu la perds tous les jours, pff.";;
M1-Carling-Habitations;Hier c'était mes pompes !;;
M1-Carling-Jardin;"La ville est déjà entouré de fleurs en tout genre, c'est un jardin dans un jardin, vous savez pourquoi étranger ?";;
M1-Carling-Jardin;Etranger ?;;
M1-Carling-Jardin;"Beh oui quoi, vous venez de la ville, vous êtes pas un léprechaun, ça se voit !";;
M1-Carling-Jardin;Dites moi.;;
M1-Carling-Jardin;"Elles habitent avec nous, on en prend grand soin, là où Dame Nature s'occupe déjà de celles de dehors, alors on l'aide un petit peu !";;
M1-Carling-Marmite;Oh ! C'est-il pas le bon vieux Willy ??;;
M1-Carling-Marmite;Je suis le Prince Elvin.;;
M1-Carling-Marmite;"Willy !! Assied toi, plonge toi là-dedans avec moi mon gars !";;
M1-Carling-Taverne;Heyep ! Que puis-je pour vous ?;;
M1-Carling-Taverne;Savez-vous où je peux trouver un artéfact très ancien ?;;
M1-Carling-Taverne;Non mon p'tit ! Rien de tel ! Une boisson pour fêter ça ?;;
M1-Carling-Taverne;Fêter ça ?;;
M1-Carling-Taverne;"On dit qu'un arc-en-ciel n'a pas de fin, alors à ce moment, vous y ressemblez trait portrait !";;
M1-Dratakk-Baie;C'était vraiment une bonne affaire du chef d'avoir fait un troc de bois massif avec la jungle.;;
M1-Dratakk-Baie;Ah oui ?;;
M1-Dratakk-Baie;"Oué ils adorent tous nos vêtements, pains et viandes que l'on a durement volé, eh eh !";;
M1-Dratakk-Baie;A quoi vous sert autant de bois ?;;
M1-Dratakk-Baie;"Bah, je te dirais bien de voir notre flotte, mais la plupart des navires sont bien occupés.";;
M1-Dratakk-FalaisesEntrainement;J'suis sûr que ce gars peut pas faire notre entrainement !;;
M1-Dratakk-FalaisesEntrainement;Je le peux.;;
M1-Dratakk-Habitations;Pourquoi nos guerriers se préoccupent-ils de ces clebs de l'est.;;
M1-Dratakk-Habitations;Oué il serait temps qu'on puisse se régaler de tout un festin de poissons.;;
M1-Dratakk-Habitations;"Non, non... les gars, y a un trésor dans les montagnes, il serait temps d'aller occuper l'endroit sérieux.";;
M1-Dratakk-PiquesExecution;"Ha ha ! T'as raté un beau spectacles, trois têtes bien alignées.";;
M1-Dratakk-Taverne;Err... Bonjour ?;;
M1-Dratakk-Taverne;T'es pas le bienvenue.;;
M1-Dratakk-Taverne;Dégage !;;
M1-Dunad-CaserneSousDune;"Tous les soldats sont opérationnels dans les caches du désert, prêt à embusquer des ennemis.";;
M1-Dunad-CaserneSousDune;"Très bien, dites, je me demandais comment ce bâtiment ne s'effondrait pas sous le sable.";;
M1-Dunad-CaserneSousDune;"On a importé de nombreux matériaux de construction depuis les terres montagneuses au nord, et puis nous avons appris a consolidé le sable pour s'y introduire comme des grottes.";;
M1-Dunad-Habitations;Et encore du sable partout dans ma maison...;;
M1-Dunad-Moulins;Des moulins ici ? En plein désert ?;;
M1-Dunad-Moulins;"Oh sire Elvin, vous n'imaginez pas le vent extrême qu'il peut y avoir par ici, on importe le grain depuis le sud puis on le moudici.";;
M1-Dunad-TourDeGuet;Rien à l'horizon sire Elvin.;;
M1-Dunad-TourDeGuet;Très bien... Quelles sont ces terres vertes tout là-bàs ?;;
M1-Dunad-TourDeGuet;"C'est Carling, le hameau des léprechauns, ils se sont appropriés cette terre miracle au nord.";;
M1-Dunad-Vitrerie;Que faites-vous dans cette bâtisse ?;;
M1-Dunad-Vitrerie;On transforme le sable en verre mon p'tit bonhomme !;;
M1-Everhill-CabaneOutilleurs;"Bien le bonjour, qu'est-ce qu'il vous faut ?";;
M1-Everhill-CabaneOutilleurs;Eh bien...;;
M1-Everhill-CabaneOutilleurs;"Tournevis, marteau, clef à boulon, entonoir, vis, enclume...";;
M1-Everhill-CarrièreMarbre;"C'est vraiment éreintant... eh vous là ! Vous voulez un peu de travail, prenez ma pioche puis collectez un peu de marbre.";;
M1-Everhill-CarrièreMarbre;Pas besoin de pioche.;;
M1-Everhill-Habitations;"Bonjour , que pouvez-vous me dire sur les lieux ?";;
M1-Everhill-Habitations;Tu es nouveau c'est ça ?;;
M1-Everhill-Habitations;Oui je viens d'arriver.;;
M1-Everhill-Habitations;Barre toi ! Tu ne me voleras plus !;;
M1-Everhill-Souterrains;"Tiens vous, on a besoin d'un mineur dans les tunnels qui vont vers le sud.";;
M1-Everhill-Souterrains;"Oh, ehm, minons nous vers le royaume de Bellum ?";;
M1-Everhill-Souterrains;"Pardon ? Mais non, tu sais très bien qu'on a besoin de ce gros filon de gemmes en profondeur.";;
M1-Everhill-TourSommet;Arrête tes bétises Clifford.;;
M1-Everhill-TourSommet;"Allez, affrontez moi ! Que les nuages transmettent mes défis !";;
M1-Everhill-TourSommet;"Il ne veut rien entendre, bah, moi je redescend, j'ai besoin d'outils.";;
M1-Everhill-TourSommet;Je peux vous aider...;;
M1-Everhill-TourSommet;Oué ! Affronte moi en duel !;;
M1-Nemerod-ChampsBlé;;;
M1-Nemerod-Habitations;;;
M1-Nemerod-Porcherie;;;
M1-Nemerod-RepèreDruide;;;
M1-Nemerod-Ruines;;;
M1-Oasia-Argilerie;Vous arrivez à extraire de l'argile ici ?;;
M1-Oasia-Argilerie;"D'habitude elle se forme dans les rivières et fleuves, mais cet oasis est tellement grand et vit depuis tellement de millénaires que certaines terres sont argileuses.";;
M1-Oasia-Argilerie;Je vois.;;
M1-Oasia-CulturesAgricoles;Bonjour ! Que cultivez-vous ici ?;;
M1-Oasia-CulturesAgricoles;"Oh principalement du lin, de l'orge et des pois chiches. Au fait, vous voudriez bien m'aider pour le ramassage ?";;
M1-Oasia-CulturesAgricoles;Bien sûr.;;
M1-Oasia-ForêtPalmiers;Jolie jardin que vous avez là.;;
M1-Oasia-ForêtPalmiers;"Nous avons bien plus de palmiers que bien d'autres oasis dans le désert, cela nous permet de récolter de nommbreux fruits, voulez-vous vous joindre à nous mon prince ?";;
M1-Oasia-ForêtPalmiers;Volontiers !;;
M1-Oasia-Habitations;On est sacrément sous-payé par rapport à ce qu'ils touchent dans l'Ouest !;;
M1-Oasia-Habitations;On leur vend tout ce qu'on produit à la sueur de notre front.;;
M1-Oasia-QuaiOasis;Hmm... A quoi peut bien servir ce pont menant au coeur de l'oasis ?;;
M1-Oasia-QuaiOasis;"Les habitants y jètent tout un tas de porte-bonheur, ils atteignent le fond comme ça.";;
M1-Oasia-QuaiOasis;Pourquoi atteindre le fond avec des pièces ?;;
M1-Oasia-QuaiOasis;"Un jour, quand l'oasis se tarira, les générations futures pourront contempler la grandeur d'âme d'Oasia.";;
M1-Omocity-Entrepôt;Y a plusieurs semaines on a reçu une sacré quantité de pierres précieuses depuis la mer.;;
M1-Omocity-Entrepôt;Ils doivent avoir de grandes mines de l'autre côté.;;
M1-Omocity-Entrepôt;"J'en sais rien, si ça se trouve ils les chient ! Ha ha ha !";;
M1-Omocity-Habitations;On vit vraiment très bien ici mais il manque cruellement de viande !;;
M1-Omocity-Habitations;Moi c'est les vêtements que je trouve trop pittoresques !;;
M1-Omocity-PalaisMarchand;"Pardonnez-moi Prince Elvin, mais les dignitaires ont une réunion importante aujourd'hui.";;
M1-Omocity-PalaisMarchand;"Pas grave, je reviendrais demain.";;
M1-Omocity-PalaisMarchand;C'est-à-dire... que demain aussi !;;
M1-Omocity-Port;Il y a de nombreux navires ici.;;
M1-Omocity-Port;"En effet, on transporte principalement de l'autre côté de la mer, si vous saviez à quel point le paysage change là-bàs.";;
M1-Omocity-Port;Comment est-ce ?;;
M1-Omocity-Port;"Des bestioles de partout, des forêts gigantesques, de la pluie très souvent, oh c'est un peu l'enfer cette région, je vous déconseille.";;
M1-Omocity-PyramideOr;Je ne peux m'empêcher de regarder cette merveille.;;
M1-Omocity-PyramideOr;Ah bon ?;;
M1-Omocity-PyramideOr;C'est mon grand-père qui l'a conçu !;;
M1-Placendrie-Forge;"Oh, vous n'avez pas la tenue appropriée pour partir à l'aventure, tenez, cette cotte de maille.";;
M1-Placendrie-GuildePolymorphe;"Aah... mon jeune apprenti, vous avez fait des prodiges, vos derniers exploits ont visiblement ébloui le roi.";;
M1-Placendrie-GuildePolymorphe;Je vous remercie pour tous ces enseignements Maître Micélion.;;
M1-Placendrie-GuildePolymorphe;"Tu as un grand potentiel, et tu le sais, tu iras loin.";;
M1-Placendrie-GuildePolymorphe;"A ce propos, je souhaite un dernier entrainement avant de partir.";;
M1-Placendrie-GuildePolymorphe;"Oh, euh, oui bien sûr je comprend.";;
M1-Placendrie-GuildePolymorphe;"Bon courage, Elvin.";;
M1-Placendrie-HautQuartier;"Sire Elvin, est-il vrai que notre cité est en danger ?";;
M1-Placendrie-HautQuartier;Non ne vous inquiétez pas.;;
M1-Placendrie-HautQuartier;"Dans ce cas pourquoi nous quittez vous, si ce n'est pour diriger une armée.";;
M1-Placendrie-HautQuartier;Je pars seulement en voyage.;;
M1-Placendrie-Taverne;"Hé, tu connais pas la nouvelle ?";;
M1-Placendrie-Taverne;"Tais toi et bois, y a le Prince juste derrière !";;
M1-Placendrie-Taverne;"Moi j'en ai une bonne à t'apprendre, pas de grabuges ici, compris ?";;
M1-Placendrie-Trône;"Sire, il faut vous reposez, nos gardes surveillent toutes les frontières.";;
M1-Placendrie-Trône;Je m'en fiche ! Mon fils règlera bientôt le problème.;;
M1-Placendrie-Trône;"Père, je peux faire quelque chose d'autre ?";;
M1-Placendrie-Trône;"Dépêche toi de partir, la guerre est imminente.";;
M1-Spherod-Habitations;;;
M1-Spherod-Habitations 1;;;
M1-Spherod-Habitations 2;;;
M1-Spherod-Habitations 3;;;
M1-Spherod-Habitations 4;;;
M1-Sunnad-ChantierNaval;"Je suis surpris que votre père ne souhaite pas de navire de guerre, manque t-il de fonds ?";;
M1-Sunnad-ChantierNaval;"Pas vraiment, mais il se préoccupe des autres frontières.";;
M1-Sunnad-ChantierNaval;Bah ! En tout cas nos marchands n'en manquent pas eux !;;
M1-Sunnad-Habitations;C'est angoissant de savoir que des pirates peuvent nous piller.;;
M1-Sunnad-Habitations;"Moi c'est surtout de ma pêche dont j'ai peur, clairement je ne peux jamais m'aventurer bien loin.";;
M1-Sunnad-Muraille;Je sais bien qu'on a renforcé nos effectifs de gardes cette semaine.;;
M1-Sunnad-Muraille;Mais ?;;
M1-Sunnad-Muraille;"Franchement on voit en permanence des navires hostiles nous provoquer, s'ils passaient à l'attaque on serait mal.";;
M1-Sunnad-Phare;"Vindiou ! Une tempête va se lever demain, c'est sûr !";;
M1-Sunnad-Phare;Comment le savez-vous ?;;
M1-Sunnad-Phare;"Eh beh ! Les rumues sur l'eau ! Et puis l'angle à laquelle le vent attaque notre ville, il souffle depuis cette jungle humide. Air sec et humidité c'est explosif.";;
M1-Sunnad-TourMaritime;Cette tour au milieu de la mer sert à repérer d'éventuelles intrusions.;;
M1-Sunnad-TourMaritime;Le phare ne suffit-il pas ?;;
M1-Sunnad-TourMaritime;"Oh non mon jeune ami, le phare sert uniquement à orienter les navires de pêche et de commerce.";;
M1-TempleEnfoui-Autel;Vous entrez dans la salle de l'autel.;;
M1-TempleEnfoui-CouloirPrincipal;Vous empruntez le couloir principal.;;
M1-TempleEnfoui-Crevasse;Vous entrez dans le temple.;;
M1-TempleEnfoui-Entrée;Vous entrez dans le temple.;;
M1-TempleEnfoui-Puit;Vous entrez dans le puit.;;
M1-Villedieu-Habitations;;;
M1-Villedieu-Habitations;;;
M1-Villedieu-Habitations;;;
M1-Villedieu-Habitations;;;
M1-Villedieu-Habitations;;;
